<?xml version="1.0" encoding="UTF-8" standalone="yes"?>
<!--
Copyright (c) 2006-2008, The University of Manchester, UK.

This file is part of PsyGrid.

PsyGrid is free software: you can redistribute it and/or modify
it under the terms of the GNU Lesser General Public License as 
published by the Free Software Foundation, either version 3 of 
the License, or (at your option) any later version.

PsyGrid is distributed in the hope that it will be useful,
but WITHOUT ANY WARRANTY; without even the implied warranty of
MERCHANTABILITY or FITNESS FOR A PARTICULAR PURPOSE.  See the
GNU Lesser General Public License for more details.

You should have received a copy of the GNU Lesser General Public 
License along with PsyGrid.  If not, see <http://www.gnu.org/licenses/>.
-->
<import project="NED" xmlns:xsi="http://www.w3.org/2001/XMLSchema-instance" xsi:noNamespaceSchemaLocation="/home/lucy/svn/web2/import/etc/schemas/import.xsd">
	<sources>
		<csvsource>
			<id>0</id>
			<primary>true</primary>
			<identifiercolumn>0</identifiercolumn>
			<identifierclass>org.psygrid.dataimport.identifier.NedenParser</identifierclass>
			<filename>Personal_Details_Form.csv</filename>
			<headerrows>6</headerrows>
		</csvsource>
		<csvsource>
			<id>1</id>
			<primary>false</primary>
			<identifiercolumn>0</identifiercolumn>
			<filename>Baseline_PANSS.csv</filename>
			<headerrows>6</headerrows>
		</csvsource>
		<csvsource>
			<id>2</id>
			<primary>false</primary>
			<identifiercolumn>0</identifiercolumn>
			<filename>Baseline_Insight_Scale.csv</filename>
			<headerrows>6</headerrows>
		</csvsource>
		<csvsource>
			<id>3</id>
			<primary>false</primary>
			<identifiercolumn>0</identifiercolumn>
			<filename>Baseline_Calgary_Depression_Scale.csv</filename>
			<headerrows>6</headerrows>
		</csvsource>
				<csvsource>
			<id>4</id>
			<primary>false</primary>
			<identifiercolumn>0</identifiercolumn>
			<filename>Baseline_EQ5D.csv</filename>
			<headerrows>6</headerrows>
		</csvsource>
		<csvsource>
			<id>5</id>
			<primary>false</primary>
			<identifiercolumn>0</identifiercolumn>
			<filename>Duration_of_Untreated_Psychosis.csv</filename>
			<headerrows>6</headerrows>
		</csvsource>
		<csvsource>
			<id>6</id>
			<primary>false</primary>
			<identifiercolumn>0</identifiercolumn>
			<filename>Baseline_Global_Assessment_of_Functioning.csv</filename>
			<headerrows>6</headerrows>
		</csvsource>
		<csvsource>
			<id>7</id>
			<primary>false</primary>
			<identifiercolumn>0</identifiercolumn>
			<filename>Family_History_-_Relative_One.csv</filename>
			<headerrows>6</headerrows>
		</csvsource>
		<csvsource>
			<id>8</id>
			<primary>false</primary>
			<identifiercolumn>0</identifiercolumn>
			<filename>Baseline_CSSRI_Sociodemographic_Information.csv</filename>
			<headerrows>6</headerrows>
		</csvsource>
		<csvsource>
			<id>9</id>
			<primary>false</primary>
			<identifiercolumn>0</identifiercolumn>
			<filename>Baseline_CSSRI_Usual_Living_Situation.csv</filename>
			<headerrows>6</headerrows>
		</csvsource>
		<csvsource>
			<id>10</id>
			<primary>false</primary>
			<identifiercolumn>0</identifiercolumn>
			<filename>Baseline_CSSRI_Employment_and_Income.csv</filename>
			<headerrows>6</headerrows>
		</csvsource>
		<csvsource>
			<id>11</id>
			<primary>false</primary>
			<identifiercolumn>0</identifiercolumn>
			<filename>Baseline_CSSRI_Service_Receipt.csv</filename>
			<headerrows>6</headerrows>
		</csvsource>
		<csvsource>
			<id>12</id>
			<primary>false</primary>
			<identifiercolumn>0</identifiercolumn>
			<filename>Baseline_CSSRI_Medication_Profile.csv</filename>
			<headerrows>6</headerrows>
		</csvsource>
		<csvsource>
			<id>13</id>
			<primary>false</primary>
			<identifiercolumn>0</identifiercolumn>
			<filename>Baseline_CSSRI_Informal_Care_and_Help.csv</filename>
			<headerrows>6</headerrows>
		</csvsource>
		<csvsource>
			<id>14</id>
			<primary>false</primary>
			<identifiercolumn>0</identifiercolumn>
			<filename>Baseline_Self_Harm_(Client,_Most_Serious).csv</filename>
			<headerrows>6</headerrows>
		</csvsource>
		<csvsource>
			<id>15</id>
			<primary>false</primary>
			<identifiercolumn>0</identifiercolumn>
			<filename>Baseline_Self_Harm_(Client,_Closest).csv</filename>
			<headerrows>6</headerrows>
		</csvsource>
		<csvsource>
			<id>16</id>
			<primary>false</primary>
			<identifiercolumn>0</identifiercolumn>
			<filename>Baseline_Self_Harm_(Carer,_Most_Serious).csv</filename>
			<headerrows>6</headerrows>
		</csvsource>
		<csvsource>
			<id>17</id>
			<primary>false</primary>
			<identifiercolumn>0</identifiercolumn>
			<filename>Baseline_Self_Harm_(Carer,_Closest).csv</filename>
			<headerrows>6</headerrows>
		</csvsource>
		<csvsource>
			<id>18</id>
			<primary>false</primary>
			<identifiercolumn>0</identifiercolumn>
			<filename>Baseline_Violence_(Client,_Most_Serious).csv</filename>
			<headerrows>6</headerrows>
		</csvsource>
		<csvsource>
			<id>19</id>
			<primary>false</primary>
			<identifiercolumn>0</identifiercolumn>
			<filename>Baseline_Violence_(Client,_Closest).csv</filename>
			<headerrows>6</headerrows>
		</csvsource>
		<csvsource>
			<id>20</id>
			<primary>false</primary>
			<identifiercolumn>0</identifiercolumn>
			<filename>Baseline_Violence_(Carer,_Most_Serious).csv</filename>
			<headerrows>6</headerrows>
		</csvsource>
		<csvsource>
			<id>21</id>
			<primary>false</primary>
			<identifiercolumn>0</identifiercolumn>
			<filename>Baseline_Violence_(Carer,_Closest).csv</filename>
			<headerrows>6</headerrows>
		</csvsource>
		<csvsource>
			<id>22</id>
			<primary>false</primary>
			<identifiercolumn>0</identifiercolumn>
			<filename>Pathways_to_Care_(Collated).csv</filename>
			<headerrows>6</headerrows>
		</csvsource>
		<csvsource>
			<id>23</id>
			<primary>false</primary>
			<identifiercolumn>0</identifiercolumn>
			<filename>Pathways_to_Care_(Pathway_One).csv</filename>
			<headerrows>6</headerrows>
		</csvsource>
		<csvsource>
			<id>24</id>
			<primary>false</primary>
			<identifiercolumn>0</identifiercolumn>
			<filename>Baseline_Substance_Use.csv</filename>
			<headerrows>6</headerrows>
		</csvsource>
		<csvsource>
			<id>25</id>
			<primary>false</primary>
			<identifiercolumn>0</identifiercolumn>
			<filename>Treatment_Documentation_-_Treatment_One.csv</filename>
			<headerrows>6</headerrows>
		</csvsource>
		<csvsource>
			<id>26</id>
			<primary>false</primary>
			<identifiercolumn>0</identifiercolumn>
			<filename>Treatment_Documentation_-_Treatment_Two.csv</filename>
			<headerrows>6</headerrows>
		</csvsource>
		<csvsource>
			<id>27</id>
			<primary>false</primary>
			<identifiercolumn>0</identifiercolumn>
			<filename>Treatment_Documentation_-_Treatment_Three.csv</filename>
			<headerrows>6</headerrows>
		</csvsource>
		<csvsource>
			<id>28</id>
			<primary>false</primary>
			<identifiercolumn>0</identifiercolumn>
			<filename>Premorbid_Adjustment_Scale.csv</filename>
			<headerrows>6</headerrows>
		</csvsource>
		<csvsource>
			<id>29</id>
			<primary>false</primary>
			<identifiercolumn>0</identifiercolumn>
			<filename>Baseline_Time_Use_Interview.csv</filename>
			<headerrows>6</headerrows>
		</csvsource>
		<csvsource>
			<id>30</id>
			<primary>false</primary>
			<identifiercolumn>0</identifiercolumn>
			<filename>Baseline_Young_Mania_Scale.csv</filename>
			<headerrows>6</headerrows>
		</csvsource>
		<csvsource>
			<id>31</id>
			<primary>false</primary>
			<identifiercolumn>0</identifiercolumn>
			<filename>Six_Month_Young_Mania_Scale.csv</filename>
			<headerrows>6</headerrows>
		</csvsource>
		<csvsource>
			<id>32</id>
			<primary>false</primary>
			<identifiercolumn>0</identifiercolumn>
			<filename>Six_Month_PANSS.csv</filename>
			<headerrows>6</headerrows>
		</csvsource>
		<csvsource>
			<id>33</id>
			<primary>false</primary>
			<identifiercolumn>0</identifiercolumn>
			<filename>Six_Month_Calgary_Depression_Scale.csv</filename>
			<headerrows>6</headerrows>
		</csvsource>
		<csvsource>
			<id>34</id>
			<primary>false</primary>
			<identifiercolumn>0</identifiercolumn>
			<filename>Twelve_Month_PANSS.csv</filename>
			<headerrows>6</headerrows>
		</csvsource>
		<csvsource>
			<id>35</id>
			<primary>false</primary>
			<identifiercolumn>0</identifiercolumn>
			<filename>Twelve_Month_Calgary_Depression_Scale.csv</filename>
			<headerrows>6</headerrows>
		</csvsource>
		<csvsource>
			<id>36</id>
			<primary>false</primary>
			<identifiercolumn>0</identifiercolumn>
			<filename>Twelve_Month_Young_Mania_Scale.csv</filename>
			<headerrows>6</headerrows>
		</csvsource>
		<csvsource>
			<id>37</id>
			<primary>false</primary>
			<identifiercolumn>0</identifiercolumn>
			<filename>Twelve_Month_Insight_Scale.csv</filename>
			<headerrows>6</headerrows>
		</csvsource>
		<csvsource>
			<id>38</id>
			<primary>false</primary>
			<identifiercolumn>0</identifiercolumn>
			<filename>Twelve_Month_Global_Assessment_of_Functioning.csv</filename>
			<headerrows>6</headerrows>
		</csvsource>
		<csvsource>
			<id>39</id>
			<primary>false</primary>
			<identifiercolumn>0</identifiercolumn>
			<filename>Twelve_Month_EQ5D.csv</filename>
			<headerrows>6</headerrows>
		</csvsource>
		<csvsource>
			<id>40</id>
			<primary>false</primary>
			<identifiercolumn>0</identifiercolumn>
			<filename>Six_Month_Service_Engagment_Scale.csv</filename>
			<headerrows>6</headerrows>
		</csvsource>
		<csvsource>
			<id>41</id>
			<primary>false</primary>
			<identifiercolumn>0</identifiercolumn>
			<filename>Twelve_Month_Service_Engagment_Scale.csv</filename>
			<headerrows>6</headerrows>
		</csvsource>
		<csvsource>
			<id>42</id>
			<primary>false</primary>
			<identifiercolumn>0</identifiercolumn>
			<filename>Six_Month_Self_Harm.csv</filename>
			<headerrows>6</headerrows>
		</csvsource>
		<csvsource>
			<id>43</id>
			<primary>false</primary>
			<identifiercolumn>0</identifiercolumn>
			<filename>Six_Month_Violence.csv</filename>
			<headerrows>6</headerrows>
		</csvsource>
		<csvsource>